{
  "schema_version": 1,
  "device_id": "desktop",
  "session_id": "11111111-1111-4111-8111-111111111111",
  "connection_id": "22222222-2222-4222-8222-222222222222",
  "sequence": 7,
  "timestamp_ms": 1770000000100,
  "heartbeat_interval_ms": 30000,
  "players": [
    {
      "player": "org.mpris.MediaPlayer2.fixture",
      "player_instance_id": "33333333-3333-4333-8333-333333333333",
      "content_id": "44444444-4444-4444-8444-444444444444",
      "playback_status": "Paused",
      "can_pause": true,
      "can_play": true,
      "pause_lease": {
        "pause_command_id": "55555555-5555-4555-8555-555555555555",
        "resume_token": "66666666-6666-4666-8666-666666666666",
        "expires_at_ms": 1770001200100
      }
    }
  ]
}
